{
  "id": "candyworld",
  "title": "CandyWorld – Economia Dinâmica & AI Autônoma",
  "subtitle": "Idle management com cadeia produtiva automatizada, AI helpers e balanceamento via curvas.",
  "tags": ["AI", "Economy", "Unity", "Mobile"],
  "metrics": ["60 FPS mid-range", "<200MB memória", "State Machine", "Pooling"],
  "sections": [
    {"id": "overview", "heading": "Visão Geral", "body": "CandyWorld é um idle/management mobile game focado em automatizar produção e progressão não-linear, servindo como estudo de arquitetura, padrões de design e otimização."},
    {"id": "architecture", "heading": "Arquitetura & Padrões", "body": "Uso de State Machine para NPCs (Idle→Find→Move→Buy→Leave), Singletons controlados para sistemas centrais (Audio, Particles, UI) e Component-Based Architecture para modularidade e manutenção."},
    {"id": "ai-customers", "heading": "AI de Clientes", "body": "Clientes navegam com NavMesh e têm sistema de preferência + paciência, influenciando UX.", "code": "public enum AiStates { Idle, Find, Buy, Move, Leave };\n\nvoid Find_Enter() {\n    targetShelf = Game_.instance.buildingsManager.shelves[Random.Range(0, Game_.instance.upgrades.shelfsUnlocked)].GetComponent<Shelf_>();\n    NavMesh.SamplePosition(targetShelf.transform.position, out NavMeshHit hit, 10, NavMesh.AllAreas);\n    target = hit.position;\n    agent.SetDestination(target);\n    switch (targetShelf.tag) {\n        case \"LollipopShelf\":\n            productBubbleImage.sprite = productsSprites[0];\n            break;\n    }\n    fsm.ChangeState(AiStates.Move);\n}", "language": "csharp"},
    {"id": "ai-helper", "heading": "AI Helper Autônoma", "body": "Priorização dinâmica entre abastecer máquinas ou organizar prateleiras.", "code": "void Find_Enter() {\n    Vector3 target = Vector3.zero;\n    if (productsHolder.childCount > 0) {\n        targetShelf = FindShelf();\n    } else {\n        targetMachine = FindMachineWithMoreProducts();\n        if (targetMachine != null) {\n            target = targetMachine.outShelf.transform.position;\n        }\n    }\n    if (target != Vector3.zero) {\n        NavMesh.SamplePosition(target, out NavMeshHit hit, 20, NavMesh.AllAreas);\n        agent.SetDestination(hit.position);\n    }\n}", "language": "csharp"},
    {"id": "production", "heading": "Pipeline de Produção", "body": "Cadeia assíncrona com Coroutines, animações tween e balanceamento auto supply/demand.", "code": "IEnumerator Factory() {\n    yield return new WaitForSeconds(1);\n    if (inShelf.GetLastCollectable() != null) {\n        Ingredient_ ingredient = inShelf.GetLastCollectable() as Ingredient_;\n        IngredientType ingredientType = ingredient.type;\n        for (int i = 0; i < productsPerIngredient; i++) {\n            LeanTween.moveLocalY(piston, 0, .2f).setEase(LeanTweenType.easeInCubic).setLoopPingPong(1);\n            yield return new WaitForSeconds(.05f);\n            Product_ currentProduct = Instantiate(product, productStartPoint.position, transform.rotation);\n            currentProduct.flavor = ingredientType;\n            currentProduct.setFlavorMaterial();\n            LeanTween.value(gameObject, 0, 1, Game_.instance.upgrades.machineSpeedValue).setOnUpdate((float val)=>{\n                conveyourRenderer.material.mainTextureOffset = new Vector2(0, -val * 2);\n            });\n            yield return new WaitForSeconds(Game_.instance.upgrades.machineSpeedValue);\n            outShelf.SpawnCollectable(currentProduct);\n        }\n    }\n    StartCoroutine(Factory());\n}", "language": "csharp"},
    {"id": "progression", "heading": "Progressão Dinâmica", "body": "Curvas AnimationCurve para upgrade scaling e custo: holdItens & machineSpeed.", "code": "public int holdItensValue { get { return (int)Game_.instance.priceManager.holdItens.Evaluate((float)holdItensLevel / (maxLevel - 1)); } }\npublic float machineSpeedValue { get { return Game_.instance.priceManager.machineSpeed.Evaluate((float)machineSpeedLevel / (maxLevel - 1)); } }", "language": "csharp"},
    {"id": "performance", "heading": "Performance & Otimizações", "body": "Pooling, tween leve, loading modular, debounced saves, GC reduzido; 60 FPS estáveis mid-range."},
    {"id": "resultados", "heading": "Resultados", "body": "<60 FPS estáveis, memória <200MB, arquitetura escalável, demonstra domínio de AI, economia e otimização mobile."}
  ]
}
